<?xml version="1.0"?>
<!DOCTYPE gda_dict SYSTEM "../../libgda/libgda-dict.dtd">
<gda_dict with_functions="t">
  <gda_dsn_info dsn="Sales" user=""/>
  <gda_dict_types>
  </gda_dict_types>
  <gda_dict_procedures>
  </gda_dict_procedures>
  <gda_dict_aggregates>
  </gda_dict_aggregates>
  <gda_dict_database>
  </gda_dict_database>
  <gda_queries/>
  <gda_graphs/>
</gda_dict>
